{
  "adapter_interface_digest": "sha256:351ee8de385bf728bcf6bf140f467ab343579bf9507f9d9e94b429d96ab44c28",
  "adapter_revision_id": "adapter-revision:intent-continuity-codex-host:0.3.9",
  "authority_boundary": "Hook performance evidence is synthetic, revision-bound candidate evidence only. It cannot trust or activate hooks, approve a trial, mutate source work, notify, schedule, archive, or authorize execution.",
  "candidate_only": true,
  "cold_hard_timeout_ms": 5000,
  "evidence_integrity": "self_consistent_not_origin_authenticated",
  "execution_authorized": false,
  "measurement_id": "dad:hook-scale:295ef21620f2794c2325646cd0bb2c524f7cb9a020c77429676a470657c9d738",
  "methodology_id": "methodology:exact-content-index-scale-v1",
  "origin_authenticated": false,
  "recorded_at": "2026-07-17T11:43:19.506393+00:00",
  "results": [
    {
      "exit_code": 0,
      "failure_marker_count": 0,
      "index_command_count": 1,
      "index_digest_matches": true,
      "index_event_count": 1,
      "index_size_matches": true,
      "index_state": "warm",
      "index_valid": true,
      "latency_ms": 1496.017,
      "ledger_event_count": 1,
      "persistence_confirmed": true,
      "preexisting_event_count": 0,
      "silent": true
    },
    {
      "exit_code": 0,
      "failure_marker_count": 0,
      "index_command_count": 1001,
      "index_digest_matches": true,
      "index_event_count": 1001,
      "index_size_matches": true,
      "index_state": "warm",
      "index_valid": true,
      "latency_ms": 712.445,
      "ledger_event_count": 1001,
      "persistence_confirmed": true,
      "preexisting_event_count": 1000,
      "silent": true
    },
    {
      "exit_code": 0,
      "failure_marker_count": 0,
      "index_command_count": 10001,
      "index_digest_matches": true,
      "index_event_count": 10001,
      "index_size_matches": true,
      "index_state": "cold",
      "index_valid": true,
      "latency_ms": 2185.279,
      "ledger_event_count": 10001,
      "persistence_confirmed": true,
      "preexisting_event_count": 10000,
      "silent": true
    },
    {
      "exit_code": 0,
      "failure_marker_count": 0,
      "index_command_count": 10001,
      "index_digest_matches": true,
      "index_event_count": 10001,
      "index_size_matches": true,
      "index_state": "warm",
      "index_valid": true,
      "latency_ms": 752.372,
      "ledger_event_count": 10001,
      "persistence_confirmed": true,
      "preexisting_event_count": 10000,
      "silent": true
    }
  ],
  "schema_version": "dad.intent_continuity_hook_scale_evidence.v1",
  "source_worktree_unchanged": true,
  "supervisor_attestation_required": true,
  "synthetic_payload": true,
  "warm_latency_budget_ms": 1500.0
}
